{
  "$schema": "https://raw.githubusercontent.com/giocaizzi/CV/main/cv_builder/templates/resume/schema.json",
  "skillsColumns": 1,
  "summary": {
    "value": "AI Engineer who embeds with enterprise clients to ship production AI end-to-end, from stakeholder requirements to RAG and agent systems in production. Self-taught into code as an environmental engineer, now delivering GenAI for banks, retail and the public sector.",
    "inResume": true
  },
  "personalInfo": {
    "name": "Giorgio Caizzi",
    "email": "giocaizzi@gmail.com",
    "location": "Milan, Italy",
    "linkedin": {
      "url": "https://linkedin.com/in/giorgio-caizzi/",
      "inResume": true
    },
    "github": {
      "url": "https://www.github.com/giocaizzi/",
      "inResume": true
    },
    "webpage": {
      "url": "https://giocaizzi.xyz/",
      "inResume": false
    }
  },
  "experience": [
    {
      "title": "Associate Manager, Products (prev. Senior Consultant)",
      "company": "Jakala S.p.A.",
      "location": "Milan, Italy",
      "startDate": "May 2024",
      "endDate": null,
      "description": "",
      "longDescription": "",
      "responsibilities": [
        {
          "value": "/latex{\\textbf{Forward Deployed Engineer}} on a Banca Generali engagement, now in its second year, scoped to the AI transformation of the whole bank: embedded with the client, taking requirements and presenting outcomes directly to C-level sponsors and non-technical business owners, delivering on their Microsoft stack (Azure, Copilot) as their Microsoft partner. The custom core is a production RAG over 600k pages of internal banking regulation (PDF, Word, Excel): structure-aware chunking, hierarchical retrieval and an event-driven sync pipeline into the bank's platforms, quality-gated by a golden evaluation set. In production, rolling out across 2k employees.",
          "inResume": true
        },
        {
          "value": "Built a GraphQL wrapper over a SQL database with role-based access control, letting AI agents run SQL and geospatial queries scoped to each user's role. Non-technical users chat with their data beside a live map; productized for clients including Regione Lombardia and NielsenIQ.",
          "inResume": true
        },
        {
          "value": "Led the engineering team that built an AI pipeline generating on-model product photography for Benetton (ComfyUI with Flux and off-the-shelf LoRAs on Azure GPUs) at up to 90 SKUs/day with a human in the loop, replacing studio photoshoots for most of the brand's ecommerce imagery by autumn 2025.",
          "inResume": true
        },
        {
          "value": "Developed the vision-language pipeline that estimates a meal's carbohydrates from a single photo for T.Conto (a consumer nutrition app live on the App Store and Google Play), using agents to retrieve ingredient reference values from a vector store of the official food-composition tables.",
          "inResume": true
        },
        {
          "value": "Own the production LLMOps lifecycle: evaluation-driven development for groundedness and guardrailing, with end-to-end tracing and monitoring via OpenTelemetry, Langfuse and cloud-native dashboards.",
          "inResume": false
        },
        {
          "value": "Led a 3-person team to ship, end-to-end on Azure, an AI geolocation game for GIS Day (Esri-sponsored) whose GenAI engine generated adaptive riddles from the target's and the player's coordinates — played by around 1,500 colleagues across Jakala.",
          "inResume": false
        },
        {
          "value": "Led a team of four to build a RAG chatbot for Corriere della Sera's Il Tempo della Salute conference, grounded in an overnight video-transcription pipeline (Azure Speech, Azure AI Search).",
          "inResume": false
        }
      ],
      "inResume": true
    },
    {
      "title": "Environmental Engineer",
      "company": "AECOM URS Italia S.p.A.",
      "location": "Milan, Italy",
      "startDate": "Feb. 2021",
      "endDate": "May 2024",
      "description": "Remediation of contaminated industrial sites for ENI, Q8 and the US DoD.",
      "longDescription": "",
      "responsibilities": [
        {
          "value": "Built Python pipelines (geopandas, GDAL, rasterio, PostGIS) that turned days of manual GIS work into hours, open-sourced on GitHub as /latex{\\href{https://github.com/giocaizzi/py3dinterpolations}{\\underline{py3dinterpolations}}}.",
          "inResume": true
        },
        {
          "value": "Project management: proposals, bidding, budgeting, planning and client relations.",
          "inResume": false
        }
      ],
      "inResume": true
    },
    {
      "title": "Geospatial Data Scientist — MSc Thesis",
      "company": "Wiseair S.r.l.",
      "location": "Milan, Italy",
      "startDate": "Mar. 2020",
      "endDate": "Dec. 2020",
      "description": "Designed and implemented, in Python, a spatial-interpolation algorithm for high-resolution PM2.5 pollution mapping from a dense real-time sensor network — my MSc thesis, in collaboration with the Wiseair startup.",
      "longDescription": "",
      "responsibilities": [],
      "inResume": false
    },
    {
      "title": "Brand Activation & Live Events",
      "company": "Red Bull, GoPro EMEA",
      "location": "Italy & Europe",
      "startDate": "Nov. 2013",
      "endDate": "Feb. 2021",
      "description": "Seven years of live brand-activation for Red Bull and GoPro at major European sporting events, alongside my studies: trilingual public speaking and running games for crowds.",
      "longDescription": "",
      "responsibilities": [],
      "inResume": true
    }
  ],
  "education": [
    {
      "degree": "MSc (102/110) and BSc (97/110) in Environmental & Land Planning Engineering",
      "institution": "Politecnico di Milano",
      "location": "Milan, Italy",
      "startDate": "Sep. 2014",
      "endDate": "Dec. 2020",
      "details": {
        "msc": {
          "label": "Relevant coursework",
          "courses": "computer science (30/30), GIS & spatial data, statistical models & stochastic processes, remote sensing",
          "thesis": ""
        },
        "bsc": {
          "label": "Theses",
          "courses": "PM2.5 spatial-interpolation algorithm (Wiseair S.r.l.); facility-location optimization for Milan's public water network (MM S.p.A.)",
          "thesis": ""
        }
      },
      "inResume": true
    },
    {
      "degree": "International Baccalaureate Diploma (36/45)",
      "institution": "The British School of Brussels",
      "location": "Brussels, Belgium",
      "startDate": "Sep. 2012",
      "endDate": "May 2014",
      "details": {},
      "inResume": true
    }
  ],
  "licenses": [
    {
      "name": "Italian National Association of Engineers",
      "year": "2021",
      "inResume": false
    }
  ],
  "technicalSkills": {
    "Backend & Systems": {
      "value": "Python & TypeScript, FastAPI, REST & GraphQL, event-driven pipelines & queues, OpenTelemetry distributed tracing, Docker, CI/CD",
      "inResume": true
    },
    "Data": {
      "value": "SQL & NoSQL, Redis, vector & graph stores",
      "inResume": true
    },
    "Cloud & Infrastructure": {
      "value": "Azure, GCP, Terraform (IaC), networking, serverless",
      "inResume": true
    },
    "GenAI": {
      "value": "RAG & retrieval, multimodal, agents & MCP, evaluation-driven development",
      "inResume": true
    },
    "Geospatial": {
      "value": "PostGIS, GDAL, geopandas, shapely, rasterio, ArcGIS & QGIS",
      "inResume": false
    }
  },
  "projects": [
    {
      "name": "ralph-copilot",
      "url": "https://github.com/giocaizzi/ralph-copilot",
      "description": "autonomous agent loop for GitHub Copilot  /latex{\\faStar} 138",
      "technologies": "Copilot custom agents, git-as-memory",
      "inResume": true
    },
    {
      "name": "greenhouse",
      "url": "https://github.com/giocaizzi/greenhouse",
      "description": "smart-irrigation app exposing an MCP server to LLM agents",
      "technologies": "Python, FastAPI, MCP, Docker",
      "inResume": true
    },
    {
      "name": "btc-cycles",
      "url": "https://github.com/giocaizzi/btc-cycles",
      "description": "bitcoin-cycle analytics with a live daily dashboard",
      "technologies": "Python, PyPI, CI/CD, plotly",
      "inResume": true
    },
    {
      "name": "py3dinterpolations",
      "url": "https://github.com/giocaizzi/py3dinterpolations",
      "description": "3D geospatial interpolation toolkit (PyPI, full CI)",
      "technologies": "python, geopandas, scikit-learn, shapely",
      "inResume": false
    },
    {
      "name": "mplstrater",
      "url": "https://github.com/giocaizzi/mplStrater",
      "description": "stratigraphic log plotting for geoscience",
      "technologies": "python, geopandas, matplotlib, rasterio",
      "inResume": false
    }
  ],
  "personalSkills": {
    "Languages": {
      "value": "Italian (native), English (bilingual), French (professional working proficiency).",
      "inResume": true
    },
    "Interests": {
      "value": "Surfing, skiing and road-cycling, chased worldwide: Indonesia, Angola, South Africa, across Europe.",
      "inResume": true
    }
  },
  "footer": {
    "value": "References and letters of recommendation available on request.",
    "inResume": false
  }
}
